{
  "id": "modular",
  "title": "Modular Arithmetic (mod q)",
  "subtitle": "The clock that every lattice scheme lives on",
  "category": "foundations",
  "views": {
    "simple": "Pick a number, say 17. Now agree that whenever you count past 17, you wrap back around to 0. That's all `(mod 17)` means — arithmetic on a clock face with 17 hours instead of 12. Every lattice cryptosystem lives on such a clock; the size of the clock is called `q`. Why bother? Because wrapping makes large numbers stay small, and small numbers are what computers (and noise distributions) actually work with. The clock is the box that keeps everything finite.",
    "developer": "`a mod q` is the unique value in `{0, 1, …, q−1}` congruent to `a` modulo `q`. All LWE operations — matrix multiply, addition, comparison — happen in `Z_q`. Choice of `q` matters: it should be large enough that the noise `e` does not 'wrap around' and destroy the message structure, but small enough that operations remain efficient. Common choices: `q = 3329` (Kyber, a prime), `q = 8192` (Saber, a power of two — fast modular reduction but algebraic structure carries trade-offs). The arithmetic also defines the noise budget: rounding-style decoders typically tolerate `‖e‖_∞ < q/4`.",
    "researcher": "The ring `Z_q = Z / qZ` is the ground ring for unstructured LWE; structured variants live in `R_q = Z_q[X] / (Φ(X))` for a cyclotomic polynomial `Φ`. The choice of `q` interacts with: (1) the *NTT-friendliness* of structured rings (Kyber's `q = 3329` was chosen so that 256-point NTT works directly over `Z_q`); (2) *modulus-switching* techniques that reduce `q` to lower bandwidth at a controlled noise cost; (3) the *core-SVP* security estimate, which is mildly sensitive to `log q / n`. Prime moduli vs. power-of-two moduli have an active design debate; both are deployed in current standards."
  },
  "evidence_grade": "A",
  "evidence_note": "The mathematical content is elementary and uncontested. Engineering choices about specific values of `q` are well-justified in the standards literature.",
  "related": ["lwe", "noise"],
  "attack_links": [],
  "source_spec": null
}
