{
  "id": "ring-module-lwe",
  "title": "Ring-LWE and Module-LWE",
  "subtitle": "Adding algebraic structure for speed — what the trade buys, what it costs, and what it risks",
  "category": "foundations",
  "path": 11,
  "views": {
    "simple": "Plain LWE is honest but heavy: the public key is a big grid of random numbers, and grids grow fast — tens of kilobytes for a single key. The structured variants solve this with a pattern. Instead of storing the whole grid, store just one row and a rule for generating the others from it (roughly: rotate the row, flip a sign as it wraps). One row plus a rule is dramatically smaller than a grid, and there is a fast transform that makes the math on such patterned grids hundreds of times quicker. That is the entire reason ML-KEM keys fit in 800 bytes where FrodoKEM's take nearly ten thousand: same underlying idea, structured versus unstructured.\n\nThe catch is philosophical as much as technical: the pattern is *extra structure*, and extra structure is extra surface. An attacker gets the same rule everyone else does. To date, no known attack against the deployed schemes uses the pattern — the best attacks treat the structured problem as if it were the plain one. But \"no attack today\" is a weaker statement than \"no structure to attack,\" and that gap is precisely why unstructured designs like FrodoKEM (and this lab's own interests) exist as the conservative fallback.\n\n**Module**-LWE, the version ML-KEM actually uses, is the compromise position: a small grid *of* patterned blocks — some structure for speed, less than full Ring-LWE. One more benefit: to change security levels you just change the number of blocks, keeping every optimized inner routine identical.",
    "developer": "**Ring-LWE** moves the LWE equation from vectors over `Z_q` into the polynomial ring `R_q = Z_q[X]/(X^n + 1)` (n a power of two). One ring element `a` plays the role of an entire `n×n` matrix — structurally a negacyclic matrix: each row is the previous row rotated with a sign flip at the wrap. Two wins: **size** drops from `O(n²)` matrix entries to `n` coefficients, and **speed** — multiplication in `R_q` runs in `O(n log n)` via the number-theoretic transform (NTT), the finite-field cousin of the FFT, when `q` is chosen NTT-friendly (Kyber's `q = 3329` was picked exactly for this; see [Modular arithmetic](#/modular)).\n\n**Module-LWE** replaces the single ring element with a `k×k` matrix of ring elements of fixed degree `n = 256`. Total dimension is `k·n`: ML-KEM-512/768/1024 are `k = 2, 3, 4`. The point of the module shape is operational: one NTT implementation, one CBD sampler, one constant-time pipeline serves all three security levels — only `k` changes.\n\nConcrete comparison at NIST category 1: FrodoKEM-640 (unstructured) public key ≈ 9,616 bytes; ML-KEM-512 encapsulation key = 800 bytes. Structure is the entire difference.\n\n**Security accounting, honestly stated:** the best known attacks against deployed Ring/Module-LWE parameters do not exploit the structure — they embed the instance as unstructured LWE of dimension `k·n` and run the standard [lattice-reduction machinery](#/attacks). So today the estimate for ML-KEM-768 and a hypothetical unstructured LWE at dimension 768 with matching noise are computed the same way. The residual worry is not a known weakness; it is that ideals and modules in cyclotomic rings carry symmetries that number theorists keep finding new things to say about. If that worry ever materializes, unstructured fallbacks are the insurance policy — which is [FrodoKEM's](#/parameter-choices) stated reason to exist and the design family [S-Cloud+](#/scloud-plus) also occupies.",
    "researcher": "Lyubashevsky, Peikert & Regev (2010) define Ring-LWE over the ring of integers of a cyclotomic number field: for `R = Z[X]/(Φ_m(X))` and `R_q = R/qR`, samples are `(a, a·s + e) ∈ R_q × R_q` with `a` uniform and `e` drawn from a (suitably shaped, coordinate-correlated) error distribution. The worst-case reduction lands on **Ideal-SVP** — approximate SVP restricted to ideal lattices of `R` — rather than on GapSVP over general lattices as for plain LWE (Regev 2005). Langlois & Stehlé (2015) define **Module-LWE** over `R_q^k` and reduce from Module-SIVP; the module rank `k` interpolates: rank-1 recovers Ring-LWE, high rank with degree-1 rings recovers unstructured LWE. ML-KEM's assumption is Module-LWE at `(n, k, q) = (256, {2,3,4}, 3329)` (FIPS 203).\n\nThe structural-risk ledger, as currently known: (1) The reductions for structured variants are to *structured* worst-case problems — a hardness statement about ideal/module lattices, a strictly smaller class than all lattices. (2) Ideal-SVP is quantumly easier than general SVP at large approximation factors in cyclotomics (the Cramer–Ducas–Peikert–Regev line of work on short generators and the subsequent unit-lattice results); these approximation factors are far beyond anything relevant to the parameters of deployed schemes, and the attacks do not extend to Ring-LWE as used. (3) No published attack achieves a better concrete cost against ML-KEM by using its module structure than by ignoring it; consequently, [lattice-estimator](#/parameter-choices) analyses of structured schemes are run at the unstructured embedding dimension `k·n`.\n\nThe honest summary the atlas commits to: *structure is a pure efficiency win under current knowledge, purchased with a strictly stronger assumption whose extra strength has never been needed by an attacker — yet.* The unstructured family (FrodoKEM; the design space this lab studies) prices that residual assumption at roughly an order of magnitude in bandwidth. Reasonable engineers land on both sides; the atlas's job is to make the trade legible, not to settle it."
  },
  "evidence_grade": "B",
  "evidence_note": "The definitions and reductions (LPR 2010, Langlois-Stehlé 2015) are established results. Grade B rather than A because the load-bearing comparative claim — structure gives no attack advantage at deployed parameters — is a statement about the current cryptanalytic frontier, which moves.",
  "related": ["lwe", "ml-kem", "modular", "lattices", "parameter-choices"],
  "citations": ["lpr-2010", "langlois-stehle-2015", "kyber-2018", "frodokem-2017", "regev-2005", "fips-203-2024"],
  "attack_links": [],
  "source_spec": null,
  "checks": [
    {
      "question": "What do you actually save by adding ring structure to LWE?",
      "answer": "A factor of roughly n in both key size and multiplication time: one ring element stands in for an n×n structured matrix, and the NTT multiplies ring elements in O(n log n). Concretely at the same security category: FrodoKEM-640's public key is ~9.6 KB, ML-KEM-512's is 800 bytes. Structure is the entire difference."
    },
    {
      "question": "Does any known attack exploit the ring or module structure of ML-KEM?",
      "answer": "No. The best known attacks embed the instance as unstructured LWE of dimension k·n and run standard lattice reduction — the structure is ignored. Known structural results (quantum attacks on Ideal-SVP at huge approximation factors) do not reach deployed parameters. The honest statement is double-edged: no attack advantage from structure today, and no proof there never will be — which is exactly the hedge unstructured designs exist to cover."
    },
    {
      "question": "Where does Module-LWE sit between plain LWE and Ring-LWE?",
      "answer": "It is a k×k grid of ring elements: rank k=1 is Ring-LWE; large k over degree-1 rings recovers plain LWE. Modules dilute the algebraic structure relative to pure Ring-LWE and — operationally — let one optimized ring pipeline serve every security level by changing only k (ML-KEM uses k = 2, 3, 4)."
    }
  ]
}
