{
  "id": "ml-kem",
  "title": "ML-KEM (Kyber)",
  "subtitle": "The standardized lattice KEM — what actually happens in keygen, encapsulation, and decapsulation",
  "category": "constructions",
  "path": 12,
  "views": {
    "simple": "ML-KEM is the algorithm most of the internet is adopting for post-quantum key exchange. It began life as CRYSTALS-Kyber, won an open eight-year standards competition, and was published by NIST as FIPS 203 in August 2024. If you used a current browser today, there is a good chance an ML-KEM handshake protected the connection — running alongside classical cryptography in a [hybrid](#/hybrid-constructions), the way this atlas recommends thinking about all near-term deployment.\n\nWhat it does is narrow on purpose. ML-KEM is a *key encapsulation mechanism*: one party locks a fresh random key inside a small package only the other party can open; both sides end up holding the same secret key, and everything after that (the actual messages) is ordinary symmetric encryption. Underneath, the lock is exactly the machinery this atlas teaches: a noisy linear equation ([LWE](#/lwe), in its structured [module form](#/ring-module-lwe)), a [clock modulus](#/modular) of 3329, deliberately small [noise](#/noise), a message [encoded](#/encoding) at the widest spacing the ring allows, and parameters tuned so [decryption failure](#/decryption-failure) is functionally impossible.\n\nIt comes in three sizes — 512, 768, 1024 — trading bytes for security margin; 768 is the common default. A study note, in the lab's usual voice: this page explains a published standard; explaining it neither endorses every deployment of it nor transfers its pedigree to anything else in this repo.",
    "developer": "ML-KEM is [Module-LWE](#/ring-module-lwe) with `n = 256`, `q = 3329`, module rank `k ∈ {2, 3, 4}`, CBD noise, everything NTT-native, wrapped in a Fujisaki-Okamoto transform. The three algorithms:\n\n**KeyGen.** Expand a public seed into the matrix `A ∈ R_q^{k×k}` (SHAKE — the seed *is* the matrix, so the public key stores 32 bytes instead of a matrix). Sample small `s, e` from CBD. Publish `t = A·s + e` (with the seed); keep `s`. This is the [LWE equation](#/lwe) verbatim, one level up in structure.\n\n**Encaps.** Pick a random 32-byte message `m`. Derive *all* randomness deterministically from `m` and a hash of the public key. Build the reply-direction ciphertext: `u = Aᵀr + e₁`, `v = tᵀr + e₂ + Encode(m)` — the same trick as [reconciliation's](#/reconciliation) encryption-style pattern: the shared secret rides inside the [encoding](#/encoding), placed at spacing `q/2`. Compress (round) `u` and `v` — rounding error acts as additional noise the [budget](#/decryption-failure) must absorb. The shared key is derived from `m` and the ciphertext context.\n\n**Decaps.** Use `s` to compute `v − sᵀu ≈ Encode(m) + small noise`, decode to recover `m` — then **re-encrypt**: rerun Encaps with the recovered `m` and check the result equals the received ciphertext byte-for-byte. Match → output the real key. Mismatch → output a pseudorandom key derived from a secret rejection value (*implicit rejection* — no error signal an attacker can probe). That re-encryption check is the FO transform, and it is what upgrades a merely-CPA-secure core into an IND-CCA2 KEM. It must run in constant time; branching on it is a canonical [side-channel](#/side-channels) mistake.\n\nSizes: encapsulation keys 800 / 1,184 / 1,568 bytes and ciphertexts 768 / 1,088 / 1,568 bytes for ML-KEM-512 / 768 / 1024. Failure rates δ around `2⁻¹³⁹` / `2⁻¹⁶⁴` / `2⁻¹⁷⁴` per FIPS 203's accounting.",
    "researcher": "Formal shape: ML-KEM = FO^̸⊥ (implicit-rejection Fujisaki-Okamoto, in the Hofheinz-Hövelmanns-Kiltz modular analysis) applied to K-PKE, an IND-CPA public-key scheme whose security is exactly decisional Module-LWE at `(n, k, q) = (256, {2,3,4}, 3329)` — see [Ring/Module-LWE](#/ring-module-lwe) for the assumption and its reductions. Security claims are stated in the ROM with QROM analyses available at some tightness cost; the decapsulation-failure probability enters the CCA bound explicitly, which is one of the two reasons δ is driven to `2⁻¹³⁹` and below (the other being [adaptive failure attacks](#/decryption-failure)).\n\nDesign details that carry the proof and the implementation discipline: derandomized encryption (`r, e₁, e₂` derived from `m ‖ H(ek)`) makes the re-encryption check meaningful; hashing the public key into both the randomness and the shared secret provides contributory behavior and multi-target protection; implicit rejection removes the decryption-failure oracle that explicit-rejection variants leak; ciphertext compression `(d_u, d_v)` trades bandwidth against additional rounding noise in the [failure budget](#/decryption-failure). FIPS 203 differs from round-3 Kyber in small, documented ways (e.g., input-validation requirements and domain-separation tweaks) — implementers should treat the FIPS text, its test vectors, and its known-answer tests as the contract, not the round-3 paper.\n\nConcrete security posture per the standard's own methodology: claimed categories 1 / 3 / 5 for the three parameter sets, with core-SVP-style estimates produced by the [lattice-estimator](#/parameter-choices) machinery at unstructured embedding dimension `k·n`; the numbers move with cryptanalysis and the standard's categories deliberately include margin. Known-risk register: the module *structure* question ([Ring/Module-LWE](#/ring-module-lwe)), implementation leakage ([side-channels](#/side-channels) — masked implementations carry measured overhead), and the generic caveat this lab attaches to every concrete estimate: numbers without methodology are not results. The atlas page is a study of FIPS 203 as published; deployment guidance stays with the [hybrid](#/hybrid-constructions) posture."
  },
  "evidence_grade": "A",
  "evidence_note": "ML-KEM is a finalized federal standard (FIPS 203, August 2024) with eight years of open analysis behind it; the construction description here is checkable against the standard's text. Grade A for the construction and its provenance — while noting, as always, that concrete security *estimates* are a moving frontier (that caveat lives at grade B in Parameter choices).",
  "related": ["ring-module-lwe", "hybrid-constructions", "parameter-choices", "encoding", "decryption-failure", "threat-model"],
  "citations": ["fips-203-2024", "kyber-2018", "dvv-2019", "giacon-2018"],
  "attack_links": [],
  "source_spec": null,
  "checks": [
    {
      "question": "ML-KEM is a \"KEM\", not an encryption scheme. What is the difference, and why does it matter?",
      "answer": "A KEM does one narrow job: transport a single fresh random key. Encapsulation outputs (ciphertext, shared key); decapsulation recovers the shared key; bulk data is then encrypted symmetrically. Narrowing the job is what makes the FO security argument, the failure-probability accounting, and constant-time implementation tractable — general-purpose lattice encryption would have to defend a much wider interface."
    },
    {
      "question": "Why does decapsulation re-encrypt the message it just decrypted?",
      "answer": "That is the Fujisaki-Okamoto transform. Because encryption randomness is derived deterministically from the message, an honest ciphertext is reproducible — so decapsulation re-runs encryption and compares. Any tampered ciphertext fails the comparison and yields a pseudorandom key instead of an error (implicit rejection), giving a chosen-ciphertext attacker no signal. It converts the CPA-secure core into an IND-CCA2 KEM — and the comparison must be constant-time, or it becomes a side channel."
    },
    {
      "question": "What actually changes between ML-KEM-512, -768, and -1024?",
      "answer": "Essentially one knob: the module rank k = 2, 3, 4 (total lattice dimension 256·k), plus small adjustments to noise widths and ciphertext compression. The ring, the modulus q = 3329, and the NTT pipeline are identical across all three — that is the module design paying off operationally (see Ring-LWE and Module-LWE)."
    }
  ]
}
