{
  "id": "hybrid-constructions",
  "title": "Hybrid constructions",
  "subtitle": "Classical and post-quantum, combined so neither one alone is the single point of failure",
  "category": "foundations",
  "path": 14,
  "views": {
    "simple": "The conservative move when nobody is sure which math will hold up: use two locks at once. A hybrid post-quantum construction combines a classical algorithm (ECDH, the workhorse that protects most of the internet today) with a post-quantum algorithm (a lattice-based KEM like ML-KEM or FrodoKEM). The session key is derived from *both* outputs, so that breaking only one of them leaves the secret intact. If quantum computers turn out to break the classical half a decade from now, the post-quantum half still holds. If a future cryptanalyst finds a flaw in the post-quantum scheme, the classical half still holds. You only lose the secret if *both* fall — a much higher bar than either alone. This is the position the lab's [CONSTITUTION Article 1](../../CONSTITUTION.md) commits to: prefer reviewed primitives and hybrid constructions; do not bet a session's security on a single new assumption.",
    "developer": "A hybrid KEM combines two underlying KEMs `KEM₁` (classical, e.g. X25519) and `KEM₂` (post-quantum, e.g. ML-KEM-768) into a composite KEM whose shared secret is a key-derivation-function output over both component secrets and both ciphertexts:\n\n```\n(c₁, K₁) ← KEM₁.Encaps(pk₁)\n(c₂, K₂) ← KEM₂.Encaps(pk₂)\nK         ← KDF(K₁ ‖ K₂ ‖ c₁ ‖ c₂ ‖ context)\nciphertext = (c₁, c₂)\n```\n\nThe KDF input — specifically, including both ciphertexts and a binding context string — is the load-bearing part. A naive `KDF(K₁ ‖ K₂)` is **not** robust: Giacon, Heuer, Poettering (2018) showed that for some component KEMs you also need *ciphertext binding* to defend against mauling / re-encryption attacks that would otherwise break IND-CCA of the combined construction. Real-world hybrid designs — the IETF TLS hybrid-KEM drafts (X25519+ML-KEM-768), CNSA 2.0 (P-256+ML-KEM-768), conservative profiles using X25519+FrodoKEM-976 — all use ciphertext binding and a strong KDF (HKDF-SHA-384 or SHA-512). **Why bother?** Three reasons: **(1) Hedge against cryptanalysis surprise.** The formal security argument for any PQ KEM is concrete, not asymptotic, and could weaken; the classical KEM's argument is well-aged but fails to a future cryptographically-relevant quantum computer. Hybrid covers both bets. **(2) Regulatory + compliance.** Many deployments cannot drop the classical primitive yet (FIPS-140-3 module boundaries, audit trails). Hybrid is the only path that adds PQ protection without breaking those constraints. **(3) Constitutional conservatism.** Inventing a primitive requires a Cryptographer BLOCK-clearance per the [CONSTITUTION](../../CONSTITUTION.md); combining two reviewed primitives in a documented way does not. The hybrid is the conservative default, and it is the construction the lab's [`slff`](../../slff/spec/FORMAT-OVERVIEW.md) container is built to carry natively.",
    "researcher": "The standard hybrid-KEM security target is IND-CCA2 with the property that breaking the hybrid requires breaking **both** underlying KEMs — formally, `Adv^{ind-cca}_{Hybrid}(A) ≤ ε₁ + ε₂` where `ε_i` is the IND-CCA advantage against `KEM_i`, modulo standard model-specific reductions. Giacon, Heuer, Poettering (PKC 2018) proved this for several combiner constructions under different KEM models; the 'concatenate-then-KDF-with-ciphertext-binding' combiner is the standard pattern, with the XOR-then-KDF combiner an alternative in restricted regimes. Bindel, Brendel, Fischlin, Goncalves, Stebila (PQCrypto 2019) extended the analysis to authenticated key exchange in the post-quantum transition setting, with explicit models for forward secrecy, post-quantum security, and the harvest-now-decrypt-later threat. **Ciphertext binding is necessary, not optional.** Without it, a combiner over a malleable or non-binding component KEM — where a ciphertext can be transformed to produce a related shared secret — can lose IND-CCA of the combined construction even though each component is IND-CCA on its own. The Giacon-Heuer-Poettering paper carries the canonical counter-example. **For deployment**, the current consensus instantiations are X25519+ML-KEM-768 (the dominant TLS draft), P-256+ML-KEM-768 (CNSA 2.0), and X25519+FrodoKEM-976 in some conservative profiles where structure-free assumptions are preferred. **The lab's position**: the hybrid construction is the only KEM family the [CONSTITUTION](../../CONSTITUTION.md) endorses without per-instance BLOCK-clearance, and [`slff/spec/FORMAT-OVERVIEW.md`](../../slff/spec/FORMAT-OVERVIEW.md) treats the pair `(classical_alg_id, pq_alg_id)` as the suite primary key — there is no single-primitive suite encoding in the format, by design."
  },
  "evidence_grade": "A",
  "evidence_note": "The hybrid-KEM combiner analysis (Giacon-Heuer-Poettering 2018, Bindel et al. 2019) is the canonical formal basis for current deployments; the ciphertext-binding requirement and the IND-CCA reduction are well-established. Grade A because the underlying proofs are stable; the deployment landscape moves but the construction pattern does not.",
  "related": [
    "lwe",
    "attacks",
    "side-channels"
  ],
  "citations": [
    "giacon-2018",
    "bindel-2019",
    "kyber-2018",
    "frodokem-2017"
  ],
  "attack_links": [],
  "source_spec": null,
  "checks": [
    {
      "question": "Why is KDF(K₁ ‖ K₂) — without the ciphertexts — not a safe combiner?",
      "answer": "Giacon, Heuer & Poettering (2018) showed that over some component KEMs, a combiner without ciphertext binding loses IND-CCA even though both components have it: a mauled ciphertext can yield a *related* shared secret the KDF cannot distinguish. Feeding c₁ and c₂ into the KDF makes any ciphertext modification change the derived key. The binding is load-bearing, not belt-and-braces."
    },
    {
      "question": "Under what circumstances does a hybrid construction actually fail?",
      "answer": "Only when both components fall within the window the secret must survive: the classical half to a cryptographically relevant quantum computer AND the post-quantum half to new cryptanalysis. Either alone leaves the derived key secure — that conjunction is the entire argument, and it is why the lab's CONSTITUTION endorses hybrids as the only KEM family not requiring per-instance clearance."
    }
  ]
}
