{
  "id": "lattices",
  "title": "Lattices",
  "subtitle": "Grids of points in high-dimensional space — and why they are hard",
  "category": "foundations",
  "views": {
    "simple": "Imagine an infinite sheet of graph paper. The grid points are a *lattice* — a regular, evenly-spaced pattern of dots. Now imagine that same grid in three dimensions. Then in four hundred. The dots are still perfectly regular, but the patterns are no longer something you can picture. Find the dot nearest to a given target in 400 dimensions and you have just solved a problem that protects messages from quantum computers. The simplicity of the picture is what makes the difficulty so surprising: nothing about a grid *looks* hard, until the dimensions stack up.",
    "developer": "A lattice is the set of all integer combinations of a fixed *basis* of vectors: `L = { a₁·b₁ + a₂·b₂ + … + aₙ·bₙ : aᵢ ∈ Z }`. Same lattice, different bases — and the difference matters: a *good* (short, near-orthogonal) basis makes problems easy, a *bad* (long, skewed) basis makes them hard. The public key in a lattice scheme is effectively a bad basis; the private key is a good one. The two canonical hard problems: **SVP** (shortest vector) and **CVP** (closest vector). Approximate versions of these, in high dimensions, are what concrete crypto rests on.",
    "researcher": "A full-rank lattice `L ⊂ R^n` is a discrete additive subgroup generated by a basis `B = (b₁, …, bₙ)`. **SVP_γ**: given `B`, find `v ∈ L \\ {0}` with `‖v‖ ≤ γ · λ₁(L)`. **CVP_γ**: given `B` and target `t`, find `v ∈ L` with `‖v − t‖ ≤ γ · dist(t, L)`. **GapSVP_γ** and **SIVP_γ** are the standard worst-case problems used in reductions. The state-of-the-art attacks are BKZ-style block reduction with sieving subroutines; security estimates are produced by *lattice estimators* (e.g. the LWE-estimator), not by closed-form proofs. The cryptographic story: LWE-hardness reduces (worst-case to average-case) to GapSVP/SIVP, giving structural — not numerical — confidence."
  },
  "evidence_grade": "A",
  "evidence_note": "The mathematical definitions are standard and uncontested. The cryptographic hardness assumptions (GapSVP, SIVP at the parameter regimes we use) are well-studied but, like all hardness assumptions, not proven.",
  "related": ["lwe", "noise"],
  "attack_links": [],
  "source_spec": null
}
