{
  "id": "side-channels",
  "title": "Side channels",
  "subtitle": "When the math is fine and the implementation leaks anyway",
  "category": "engineering",
  "views": {
    "simple": "A cipher can be perfectly secure on paper and still leak its secret in the real world. The leak does not come from the math — it comes from the *physical act* of running the math. A chip that takes a few microseconds longer when its secret happens to contain a 1 than when it contains a 0 is whispering the secret to anyone with a stopwatch. Watching a power meter, listening for electromagnetic emissions, or even nudging the chip with a precisely-timed voltage glitch — all of these have, in published research, extracted cryptographic keys from devices the math believed were safe. The fix is not better math; it is implementation discipline: every operation that touches a secret must take the same time, draw the same power, and follow the same code path regardless of what the secret is. The whole family of techniques is called *constant-time programming*, and getting it right is hard enough that the field still finds new mistakes in old code every year.",
    "developer": "Side-channel attacks recover secret material from a correctly-implemented cryptographic primitive by observing physical or microarchitectural signals the abstract algorithm does not model. Four canonical channels. **(1) Timing.** Execution-time differences that depend on secret data — branching on a secret, indexing a table at a secret address, calling variable-time arithmetic with secret-dependent operand sizes. The seminal demonstration is Kocher (1996) against RSA, DH, and DSS. Defense: constant-time implementations; no branches and no memory accesses with secret-dependent addresses. **(2) Power analysis.** Simple Power Analysis (SPA) reads the trace directly; Differential Power Analysis (DPA, Kocher-Jaffe-Jun 1999) recovers keys statistically across many traces. Defense: *masking* (split secrets into shares so no single intermediate carries the whole secret) and *hiding* (noise injection, dual-rail logic). **(3) Electromagnetic emanations.** Same underlying physics as power analysis but read by a different sensor; harder to defend because EM emissions can sometimes be measured at a distance from the device. **(4) Fault injection.** Voltage or clock glitches, lasers, deliberate undervolting — corrupting the computation to produce a single *faulty* output that, combined with a correct one, leaks the key (the canonical Boneh-DeMillo-Lipton 1997 attack against RSA-CRT). **For lattice KEMs specifically**, the common pitfalls are: secret-dependent rejection sampling, Gaussian-discrete sampling via secret-indexed lookup tables (which is why CBD sampling is preferred), non-constant-time modular reduction, and decapsulation code that branches on the re-encryption check inside the Fujisaki-Okamoto transform. ML-KEM, FrodoKEM, and the lab's candidate `sl-kem` all owe their constant-time guarantees to specific implementation choices, not to the abstract spec. **Side-channels are out of scope for the formal security argument** — they are the [Engineer persona](../../sl-researchkit/personas/ENGINEER.md)'s territory and the reason Article 5 of the [CONSTITUTION](../../CONSTITUTION.md) says *every concept ships with three views* rather than *every concept ships with one proof*.",
    "researcher": "Formally, a side-channel adversary `A^O` interacts with an implementation `Impl(K)` of a primitive `P` parameterized by secret `K`, with access to a leakage oracle `O` modeling the physical channel. The structural problem: the standard IND-CCA proof for `P` bounds `Adv^{ind-cca}_P(A)` against any PPT adversary; it does NOT bound `Adv^{ind-cca}_{Impl(P)}(A^O)` against a leakage-aware adversary unless `Impl` is *leakage-resilient* by construction. Leakage models of varying strength appear in the literature — bounded-leakage, noisy-leakage, simulatable-leakage, threshold-implementation — each with corresponding compiler-style constructions whose overhead and assumptions differ. **For lattice KEMs**, documented attack surfaces include: (i) timing leakage in CBD or discrete-Gaussian sampling (the BLISS-signature timing attack on rejection sampling generalizes to KEM samplers); (ii) cache-timing leakage in number-theoretic-transform implementations and in modular-reduction code; (iii) DPA on the key-decapsulation Hamming-weight signal, with multiple published results against Kyber and Saber implementations; (iv) chosen-ciphertext fault attacks that recover the long-term secret via single-bit faults in decapsulation, again with published results against both Kyber and Saber. The standard defenses — first-order masking with `t+1` shares, table-free sampling (CBD instead of Gaussian-discrete tables), constant-time NTT, FO-transform decapsulation that does not branch on the re-encryption check — are widely deployed but not free: masked Kyber implementations carry a 2–5× cycle penalty for first-order security, more for higher orders. The lab's position: side-channel security is a *contract between the spec and a specific implementation*; an atlas concept cannot ship a side-channel-secure implementation, only a clear statement of what an implementation must promise."
  },
  "evidence_grade": "B",
  "evidence_note": "The four canonical channels and their foundational references (Kocher 1996 timing, Kocher-Jaffe-Jun 1999 DPA, Boneh-DeMillo-Lipton 1997 faults) are well-established. The lattice-KEM-specific attack results cited are real published research; specific paper citations beyond Kocher are named in prose without being individually registered (carried forward as a not-blocking note in the manner of the Attacks review).",
  "related": ["attacks", "noise", "encoding"],
  "citations": ["kocher-1996", "kocher-1999"],
  "attack_links": [],
  "source_spec": null
}
