{
  "id": "threat-model",
  "title": "The quantum threat model",
  "subtitle": "Why post-quantum cryptography exists — and why the migration started before the computer did",
  "category": "foundations",
  "path": 1,
  "views": {
    "simple": "Almost everything private on the internet — messages, bank logins, medical records — is protected by math problems that today's computers cannot solve in any reasonable time. A sufficiently large quantum computer would solve two of the most important ones (factoring large numbers and computing discrete logarithms) quickly, and with them would fall most of the public-key cryptography actually deployed today. No such machine publicly exists, and honest experts disagree about when one will — years and decades are both on the table.\n\nSo why act now? Because of a quiet attack that requires no quantum computer at all: **harvest now, decrypt later**. An adversary can record encrypted traffic today, store it cheaply, and decrypt it the day the machine arrives. If a secret must stay secret for ten years, then encrypting it today with quantum-breakable math is *already* a present-tense failure — the recording is happening now, whether or not the decryption ever does.\n\nThere is a second clock too: migrations are slow. Replacing the cryptography inside browsers, phones, banks, and governments takes on the order of a decade. A useful way to say it (due to Michele Mosca): if the time your secrets must live, *plus* the time the migration takes, exceeds the time until a big enough quantum computer — you are already late. That inequality, not a prediction about hardware, is why the field moved: an open standards competition ran from 2016, and in August 2024 the first post-quantum standards were published, including ML-KEM — the lattice-based scheme most of this atlas builds toward understanding. The rest of the atlas explains the math that replacement rests on.",
    "developer": "What breaks and what survives, concretely. **Breaks outright:** RSA, finite-field Diffie-Hellman, and all elliptic-curve cryptography (ECDH, ECDSA, Ed25519). Shor's algorithm solves factoring and discrete logarithms in polynomial time on a fault-tolerant quantum computer — these are not weakened, they are *ended* for a sufficiently capable machine. **Mostly survives:** symmetric cryptography. Grover's search gives at most a quadratic speedup against exhaustive key search, so AES-128's effective quantum margin shrinks toward ~64-bit-equivalent work (with severe practical caveats — Grover parallelizes poorly), and AES-256 remains comfortable. SHA-2/SHA-3 similarly survive with margin adjustments. **The engineering consequence:** the migration is about key establishment and signatures, not about replacing your AEAD.\n\nThe operative threat for a working engineer is **harvest-now-decrypt-later**: any TLS session whose key exchange is pure ECDH can be recorded today and opened retroactively. That is why deployed mitigations lead with the KEM side (TLS hybrid key agreement, X25519+ML-KEM-768, shipped in major browsers) while signature migration — where retroactive attack matters less, since a forged signature must be accepted *in the future* — moves slower.\n\nTimeline honesty: there is no public cryptographically-relevant quantum computer, and resource estimates for breaking RSA-2048 have been falling but remain far beyond current hardware. The planning tool is **Mosca's inequality**: if `x` (years your data must stay confidential) + `y` (years your migration takes) > `z` (years until a cryptographically relevant machine), you are already exposed. For `x = 10` and realistic `y ≥ 5`, most estimates of `z` put long-lived secrets inside the danger zone today — which is the actual argument, independent of anyone's hardware forecast. The conservative deployment answer is [hybrid constructions](#/hybrid-constructions): classical + post-quantum combined so that neither assumption is a single point of failure.",
    "researcher": "The adversary model that motivates PQC. A **cryptographically relevant quantum computer (CRQC)** is a fault-tolerant machine large enough to run Shor's algorithm (Shor 1997) against deployed key sizes — polynomial-time factoring and discrete log, including over elliptic-curve groups. Against symmetric primitives, Grover's algorithm gives a provably optimal quadratic black-box speedup; its poor parallelization (the depth-times-width trade-off) means practical quantum advantage against AES-256 is negligible, and NIST's PQC security categories accordingly calibrate against exhaustive key search on AES rather than assuming free Grover.\n\nFormally, the transition literature distinguishes adversaries by *when* quantum capability arrives relative to the protocol run: the harvest-now-decrypt-later adversary is classical at protocol time and quantum later — this is the weakest quantum adversary and already breaks the confidentiality of every recorded pure-ECDH transcript. Bindel et al. (2019) give explicit two-stage models for hybrid authenticated key exchange under exactly this adversary, which is the formal grounding for the hybrid deployments described in [Hybrid constructions](#/hybrid-constructions). Signature security degrades differently: unforgeability must hold against a *future* attacker only for keys still trusted at that time, which is why key-establishment migration is the urgent half.\n\nStandards state: NIST's open post-quantum process (2016–2022 selection) produced FIPS 203 (ML-KEM, lattice KEM), FIPS 204 (ML-DSA, lattice signatures), and FIPS 205 (SLH-DSA, hash-based signatures), all finalized August 2024. Deployment consensus leads with hybrids (X25519+ML-KEM-768 in TLS; CNSA 2.0 mandates ML-KEM for national-security systems on a dated schedule). Migration-planning doctrine follows Mosca (2018): the inequality `x + y > z` is a statement about *risk posture under uncertainty in z*, not a forecast — the lab treats CRQC-arrival estimates as unknowable and grades accordingly. What LWE-based cryptography offers against this adversary — and what it does not (see [Attacks](#/attacks): quantum speedups against lattices are exponent-constant improvements, not Shor-style collapses) — is the subject of the rest of this atlas."
  },
  "evidence_grade": "B",
  "evidence_note": "Shor's and Grover's algorithms and their consequences for deployed cryptography are settled science (grade A on their own). The threat-model synthesis — harvest-now-decrypt-later urgency, migration timelines, CRQC arrival uncertainty — is deliberately graded B: the math is certain, the timeline is not, and the concept says so explicitly.",
  "related": ["lwe", "hybrid-constructions", "attacks", "ml-kem"],
  "citations": ["shor-1997", "mosca-2018", "fips-203-2024", "bindel-2019"],
  "attack_links": [],
  "source_spec": null,
  "checks": [
    {
      "question": "Nobody has a quantum computer that can break RSA today. Why does the migration need to happen now anyway?",
      "answer": "Two clocks are running. First, **harvest-now-decrypt-later**: encrypted traffic recorded today can be decrypted the day a big enough machine exists, so anything that must stay secret for years is already exposed to a future adversary — the recording requires no quantum computer. Second, migrations at internet scale take on the order of a decade. Mosca's inequality makes it crisp: if secrecy-lifetime plus migration-time exceeds the time until a cryptographically relevant quantum computer, starting later means arriving late."
    },
    {
      "question": "Which of today's cryptography actually breaks, and which mostly survives?",
      "answer": "Public-key cryptography built on factoring and discrete logarithms — RSA, Diffie-Hellman, all elliptic-curve schemes — breaks outright via Shor's algorithm. Symmetric ciphers and hashes mostly survive: Grover's search only halves the effective security exponent (and parallelizes poorly), so AES-256 stays comfortable. That is why the migration targets key exchange and signatures, not AEAD ciphers."
    },
    {
      "question": "If ML-KEM is standardized, why do serious deployments still pair it with X25519 instead of using it alone?",
      "answer": "Hedging in both directions. Lattice assumptions are younger than the classical ones and their concrete security estimates still move with cryptanalysis; the classical half fails only to a future quantum computer. A hybrid loses only if *both* fall — see [Hybrid constructions](#/hybrid-constructions) for why that is the conservative default rather than an excess of caution."
    }
  ]
}
